{
  "schema_version": "2.0",
  "kind": "review",
  "task_id": "WP-00",
  "candidate_revision": "0000000000000000000000000000000000000000",
  "summary": "TEMPLATE — an independent reviewer must inspect the exact candidate and record actual results.",
  "profile_id": "gpt-5.6-sol-max",
  "routing_policy_digest": "0000000000000000000000000000000000000000000000000000000000000000",
  "checks": [
    {
      "id": "independent-candidate-review",
      "required": true,
      "status": "NOT_RUN"
    }
  ]
}
