{
  "schema_version": "2.0",
  "kind": "budget",
  "summary": "TEMPLATE — no spending authorized; replace only after an accountable owner approves the exact amount, scope and validity.",
  "owner": "human:owner",
  "approved_budget_usd": 0,
  "scope": "TEMPLATE — describe the bounded local Texenda development scope.",
  "work_packages": [
    "WP-00"
  ],
  "roles": [
    "author",
    "reviewer"
  ],
  "issued_at": "1970-01-01T00:00:00Z",
  "expires_at": "1970-01-02T00:00:00Z",
  "routing_policy_digest": "0000000000000000000000000000000000000000000000000000000000000000",
  "work_package_digest": "0000000000000000000000000000000000000000000000000000000000000000",
  "checks": [
    {
      "id": "owner-budget-authorization",
      "required": true,
      "status": "NOT_RUN"
    }
  ],
  "notes": "This template is deliberately expired, has placeholder digests and no passing owner evidence. The harness does not invoke models or meter a provider."
}
